[
  {"id":"sagra-2026-cinghiale-gioia-dei-marsi","startDate":"2026-08-01","endDate":"2026-08-01","displayDate":"1 agosto","title":"Sagra del cinghiale","venue":"Gioia dei Marsi","province":"AQ","sourceLabel":"Sagre in Abruzzo — Agosto 2026","updatedAt":"2026-08-01"},
  {"id":"sagra-2026-coda-vaccinara-cappelle-dei-marsi","startDate":"2026-08-01","endDate":"2026-08-01","displayDate":"1 agosto","title":"Sagra della coda alla vaccinara","venue":"Cappelle dei Marsi","province":"AQ","sourceLabel":"Sagre in Abruzzo — Agosto 2026","updatedAt":"2026-08-01"},
  {"id":"sagra-2026-tartufo-san-bartolomeo-scoppito","startDate":"2026-08-01","endDate":"2026-08-02","displayDate":"1–2 agosto","title":"32° Sagra del tartufo","venue":"San Bartolomeo di Scoppito","province":"AQ","sourceLabel":"Sagre in Abruzzo — Agosto 2026","updatedAt":"2026-08-01"},
  {"id":"sagra-2026-lenticchia-fritto-alanno","startDate":"2026-08-01","endDate":"2026-08-02","displayDate":"1–2 agosto","title":"41° Sagra della lenticchia e del fritto","venue":"Alanno","province":"PE","sourceLabel":"Sagre in Abruzzo — Agosto 2026","updatedAt":"2026-08-01"},
  {"id":"sagra-2026-controquerra","startDate":"2026-08-01","endDate":"2026-08-02","displayDate":"1–2 agosto","title":"39° Sagra di Controguerra","venue":"Controguerra","province":"TE","sourceLabel":"Sagre in Abruzzo — Agosto 2026","updatedAt":"2026-08-01"},
  {"id":"sagra-2026-fara-cipollara","startDate":"2026-08-01","endDate":"2026-08-02","displayDate":"1–2 agosto","title":"21° Fara Cipollara","venue":"Fara Filiorum Petri","province":"CH","sourceLabel":"Sagre in Abruzzo — Agosto 2026","updatedAt":"2026-08-01"},
  {"id":"sagra-2026-vini-montepagano","startDate":"2026-08-01","endDate":"2026-08-02","displayDate":"1–2 agosto","title":"54° Mostra del vini di Montepagano","venue":"Roseto degli Abruzzi","province":"TE","sourceLabel":"Sagre in Abruzzo — Agosto 2026","updatedAt":"2026-08-01"},
  {"id":"sagra-2026-maccheroni-mulinara-bisenti","startDate":"2026-08-01","endDate":"2026-08-02","displayDate":"1–2 agosto","title":"4° Sagra dei maccheroni alla mulinara","venue":"Bisenti","province":"TE","sourceLabel":"Sagre in Abruzzo — Agosto 2026","updatedAt":"2026-08-01"},
  {"id":"sagra-2026-ranocchia-ortucchio","startDate":"2026-08-01","endDate":"2026-08-02","displayDate":"1–2 agosto","title":"20° Sagra della ranocchia","venue":"Ortucchio","province":"AQ","sourceLabel":"Sagre in Abruzzo — Agosto 2026","updatedAt":"2026-08-01"},
  {"id":"sagra-2026-timballo-teramano-floriano","startDate":"2026-08-01","endDate":"2026-08-03","displayDate":"1–3 agosto","title":"13° Sagra del timballo teramano","venue":"Floriano di Campli","province":"TE","sourceLabel":"Sagre in Abruzzo — Agosto 2026","updatedAt":"2026-08-01"},
  {"id":"sagra-2026-pipindune-ove-collecorvino","startDate":"2026-08-01","endDate":"2026-08-04","displayDate":"1–4 agosto","title":"21° Sagra pipindune e ove","venue":"Collecorvino","province":"PE","sourceLabel":"Sagre in Abruzzo — Agosto 2026","updatedAt":"2026-08-01"},
  {"id":"sagra-2026-lumache-bellante","startDate":"2026-08-01","endDate":"2026-08-07","displayDate":"1–7 agosto","title":"17° Sagra delle lumache","venue":"Bellante","province":"TE","sourceLabel":"Sagre in Abruzzo — Agosto 2026","updatedAt":"2026-08-01"},
  {"id":"sagra-2026-pecure-cotture-pacentro","startDate":"2026-08-02","endDate":"2026-08-02","displayDate":"2 agosto","title":"19° Sagra della pecure allu cutture","venue":"Pacentro","province":"AQ","sourceLabel":"Sagre in Abruzzo — Agosto 2026","updatedAt":"2026-08-01"},
  {"id":"sagra-2026-garrufo-con-gusto","startDate":"2026-08-02","endDate":"2026-08-08","displayDate":"2–8 agosto","title":"21° Garrufo con gusto","venue":"Garrufo di Sant’Omero","province":"TE","sourceLabel":"Sagre in Abruzzo — Agosto 2026","updatedAt":"2026-08-01"},
  {"id":"sagra-2026-festa-birra-pianella","startDate":"2026-08-03","endDate":"2026-08-08","displayDate":"3–8 agosto","title":"Festa della birra","venue":"Pianella","province":"PE","sourceLabel":"Sagre in Abruzzo — Agosto 2026","updatedAt":"2026-08-01"},
  {"id":"sagra-2026-festival-birre-castellalto","startDate":"2026-08-03","endDate":"2026-08-09","displayDate":"3–9 agosto","title":"19° Festival delle birre","venue":"Castellalto","province":"TE","sourceLabel":"Sagre in Abruzzo — Agosto 2026","updatedAt":"2026-08-01"},
  {"id":"sagra-2026-prosciutto-abruzzese-basciano","startDate":"2026-08-05","endDate":"2026-08-09","displayDate":"5–9 agosto","title":"57° Sagra del prosciutto abruzzese","venue":"Basciano","province":"TE","sourceLabel":"Sagre in Abruzzo — Agosto 2026","updatedAt":"2026-08-01"},
  {"id":"sagra-2026-coniglio-italiano-ancarano","startDate":"2026-08-05","endDate":"2026-08-09","displayDate":"5–9 agosto","title":"37° Sagra del coniglio italiano","venue":"Ancarano","province":"TE","sourceLabel":"Sagre in Abruzzo — Agosto 2026","updatedAt":"2026-08-01"},
  {"id":"sagra-2026-vongola-tortoreto","startDate":"2026-08-05","endDate":"2026-08-09","displayDate":"5–9 agosto","title":"48° Sagra della vongola","venue":"Tortoreto","province":"TE","sourceLabel":"Sagre in Abruzzo — Agosto 2026","updatedAt":"2026-08-01"},
  {"id":"sagra-2026-peperoncino-piccante-filetto","startDate":"2026-08-06","endDate":"2026-08-09","displayDate":"6–9 agosto","title":"19° Festival del peperoncino piccante","venue":"Filetto","province":"CH","sourceLabel":"Sagre in Abruzzo — Agosto 2026","updatedAt":"2026-08-01"},
  {"id":"sagra-2026-colle-montesilvano","startDate":"2026-08-06","endDate":"2026-08-09","displayDate":"6–9 agosto","title":"5° Sagra de Colle","venue":"Montesilvano","province":"PE","sourceLabel":"Sagre in Abruzzo — Agosto 2026","updatedAt":"2026-08-01"},
  {"id":"sagra-2026-vino-vittorito","startDate":"2026-08-07","endDate":"2026-08-08","displayDate":"7–8 agosto","title":"27° Sagra del vino","venue":"Vittorito","province":"AQ","sourceLabel":"Sagre in Abruzzo — Agosto 2026","updatedAt":"2026-08-01"},
  {"id":"sagra-2026-truffle-summer-festival","startDate":"2026-08-07","endDate":"2026-08-08","displayDate":"7–8 agosto","title":"Truffle Summer Festival","venue":"Goriano Sicoli","province":"AQ","sourceLabel":"Sagre in Abruzzo — Agosto 2026","updatedAt":"2026-08-01"},
  {"id":"sagra-2026-pizza-cesaproba","startDate":"2026-08-07","endDate":"2026-08-09","displayDate":"7–9 agosto","title":"28° Sagra della pizza","venue":"Cesaproba","province":"AQ","sourceLabel":"Sagre in Abruzzo — Agosto 2026","updatedAt":"2026-08-01"},
  {"id":"sagra-2026-abruzzo-west-festival","startDate":"2026-08-07","endDate":"2026-08-09","displayDate":"7–9 agosto","title":"Abruzzo West Festival","venue":"San Pio delle Camere","province":"AQ","sourceLabel":"Sagre in Abruzzo — Agosto 2026","updatedAt":"2026-08-01"},
  {"id":"sagra-2026-tagliarille-fascile-montazzoli","startDate":"2026-08-07","endDate":"2026-08-07","displayDate":"7 agosto","title":"34° Sagra tagliarille e fascile","venue":"Montazzoli","province":"CH","sourceLabel":"Sagre in Abruzzo — Agosto 2026","updatedAt":"2026-08-01"},
  {"id":"sagra-2026-grano-torre-dei-nolfi","startDate":"2026-08-07","endDate":"2026-08-08","displayDate":"7–8 agosto","title":"18° Sagra del grano","venue":"Torre dei Nolfi","province":"AQ","sourceLabel":"Sagre in Abruzzo — Agosto 2026","updatedAt":"2026-08-01"},
  {"id":"sagra-2026-bistecca-fossa","startDate":"2026-08-07","endDate":"2026-08-09","displayDate":"7–9 agosto","title":"47° Sagra della bistecca","venue":"Fossa","province":"AQ","sourceLabel":"Sagre in Abruzzo — Agosto 2026","updatedAt":"2026-08-01"},
  {"id":"sagra-2026-montagna-tornimparte","startDate":"2026-08-07","endDate":"2026-08-09","displayDate":"7–9 agosto","title":"45° Festa della montagna","venue":"Tornimparte","province":"AQ","sourceLabel":"Sagre in Abruzzo — Agosto 2026","updatedAt":"2026-08-01"},
  {"id":"sagra-2026-polpe-ventricina-liscia","startDate":"2026-08-08","endDate":"2026-08-08","displayDate":"8 agosto","title":"7° Sagra delle polpe di ventricina","venue":"Liscia","province":"CH","sourceLabel":"Sagre in Abruzzo — Agosto 2026","updatedAt":"2026-08-01"},
  {"id":"sagra-2026-corti-antiche-atessa","startDate":"2026-08-08","endDate":"2026-08-08","displayDate":"8 agosto","title":"Corti antiche","venue":"Atessa","province":"CH","sourceLabel":"Sagre in Abruzzo — Agosto 2026","updatedAt":"2026-08-01"},
  {"id":"sagra-2026-bruschetta-tozzanella-tossicia","startDate":"2026-08-08","endDate":"2026-08-09","displayDate":"8–9 agosto","title":"30° Sagra della bruschetta","venue":"Tozzanella di Tossicia","province":"TE","sourceLabel":"Sagre in Abruzzo — Agosto 2026","updatedAt":"2026-08-01"},
  {"id":"sagra-2026-pasta-pescosansonesco","startDate":"2026-08-08","endDate":"2026-08-09","displayDate":"8–9 agosto","title":"Sagra della pasta","venue":"Pescosansonesco","province":"PE","sourceLabel":"Sagre in Abruzzo — Agosto 2026","updatedAt":"2026-08-01"},
  {"id":"sagra-2026-arti-mestieri-castelvecchio-subequo","startDate":"2026-08-08","endDate":"2026-08-09","displayDate":"8–9 agosto","title":"14° Arti e mestieri a palazzo","venue":"Castelvecchio Subequo","province":"AQ","sourceLabel":"Sagre in Abruzzo — Agosto 2026","updatedAt":"2026-08-01"},
  {"id":"sagra-2026-wurstel-lanciano","startDate":"2026-08-08","endDate":"2026-08-10","displayDate":"8–10 agosto","title":"39° Sagra del würstel","venue":"Contrada Serre, Lanciano","province":"CH","sourceLabel":"Sagre in Abruzzo — Agosto 2026","updatedAt":"2026-08-01"},
  {"id":"sagra-2026-sapori-stelle-bucchianico","startDate":"2026-08-08","endDate":"2026-08-10","displayDate":"8–10 agosto","title":"4° Sapori di stelle","venue":"Bucchianico","province":"CH","sourceLabel":"Sagre in Abruzzo — Agosto 2026","updatedAt":"2026-08-01"},
  {"id":"sagra-2026-pizzond-torricella-sicura","startDate":"2026-08-08","endDate":"2026-08-11","displayDate":"8–11 agosto","title":"22° Sagra de li’ pizzond","venue":"Santo Stefano di Torricella Sicura","province":"TE","sourceLabel":"Sagre in Abruzzo — Agosto 2026","updatedAt":"2026-08-01"},